{
  "id": "asymmetric_dark_matter",
  "name": "Asymmetric dark matter",
  "aliases": ["ADM"],
  "type": "dynamical",
  "summary": "Dark matter carries a conserved 'dark baryon number' analogous to baryon number. A primordial asymmetry in the dark sector, related to the visible baryon asymmetry, sets the relic abundance via annihilation of the symmetric component leaving only the asymmetric residue. Naturally explains the cosmic coincidence Omega_DM / Omega_b ~ 5: if asymmetries are similar, m_DM / m_proton ~ 5.",
  "addresses_puzzles": [
    {
      "puzzle_id": "dark_matter_identity",
      "role": "ameliorates",
      "confidence": "proposed",
      "note": "Predicts m_DM ~ few GeV (compatible with sub-GeV direct-detection sensitivity) when DM and baryon asymmetries are comparable. Specific models tie the dark asymmetry to leptogenesis or Affleck-Dine."
    },
    {
      "puzzle_id": "baryon_asymmetry",
      "role": "ameliorates",
      "confidence": "proposed",
      "note": "Connects the BAU to DM origin via a shared mechanism producing both asymmetries; addresses 'why DM and baryons are within a factor of 5' as a structural prediction rather than a coincidence."
    }
  ],
  "touches_benchmarks": [
    {
      "benchmark_id": "dm_direct_detection_lz",
      "effect": "respects",
      "note": "ADM is typically lighter (few GeV) than canonical WIMPs; direct-detection bounds in this mass window are weaker but rapidly improving (CRESST, SuperCDMS, light-WIMP analyses)."
    }
  ],
  "introduces": {
    "new_fields": ["asymmetric DM particle (often Dirac fermion)"],
    "new_scales": ["m_DM ~ few GeV"],
    "new_symmetries": ["dark baryon number U(1)_DB"],
    "new_parameters_count": 4,
    "note": "DM mass, asymmetry, sharing mechanism with visible sector, symmetric-component annihilation cross-section."
  },
  "structural_features": ["dark_baryon_number", "shared_asymmetry", "cosmic_coincidence"],
  "composes_with": ["leptogenesis", "affleck_dine_baryogenesis"],
  "excludes": [],
  "status": "niche",
  "history": "Nussinov (1985) for DM ~ pi-related mass; Kaplan-Luty-Zurek (2009) modern treatment. Active in the past decade as direct-detection bounds push canonical WIMP scenarios.",
  "references": [
    {
      "citation": "Kaplan, Luty, Zurek, 'Asymmetric dark matter', Phys. Rev. D 79, 115016 (2009)",
      "arxiv": "0901.4117"
    },
    {
      "citation": "Petraki and Volkas, 'Review of asymmetric dark matter', Int. J. Mod. Phys. A 28, 1330028 (2013)",
      "arxiv": "1305.4939"
    }
  ],
  "tags": ["dark_matter", "asymmetric", "cosmic_coincidence"]
}
